{
  "schema_version": 1,
  "experiment_id": "gate0_metal_nut_dummy_seed42",
  "category": "metal_nut",
  "method": "dummy",
  "real_train_count": 0,
  "synthetic_count": 2,
  "seed": 42,
  "generator": {
    "generation_seconds_per_image": 0.00010484457015991211,
    "config": {
      "fixture_only": true,
      "patch_fraction": 0.25
    }
  },
  "inspection": {
    "pixel_auroc": 0.5403451611918788,
    "iou": 0.03243713943615979,
    "dice": 0.0628360569319979,
    "defect_recall": 1.0,
    "image_false_positive_rate": 1.0
  },
  "training": {
    "architecture": "unet",
    "encoder": "resnet18",
    "encoder_weights": null,
    "image_size": 64,
    "steps": 1,
    "learning_rate": 0.0001,
    "loss": 0.8491775989532471
  },
  "evaluation": {
    "source": "independent_fixture",
    "count": 4,
    "threshold": 0.5,
    "smoke_only": true,
    "split_sha256": null
  },
  "provenance": {
    "git_commit": "b9c86812de615965a52f4af7137e407fb3997465",
    "git_dirty": false,
    "python": "3.10.21",
    "torch": "2.8.0+cu128",
    "cuda": "12.8",
    "device": "NVIDIA A40",
    "runtime_seconds": 1.042666799388826,
    "packages": {
      "segmentation-models-pytorch": "0.5.0",
      "torchvision": "0.23.0",
      "numpy": "2.2.6",
      "Pillow": "12.3.0",
      "scikit-learn": "1.7.2",
      "jsonschema": "4.26.0"
    }
  }
}
