{
  "schema_version": 1,
  "experiment_id": "diffusion_metal_nut_support5_seed42",
  "category": "metal_nut",
  "method": "diffusion",
  "real_train_count": 235,
  "synthetic_count": 15,
  "seed": 42,
  "generator": {
    "generation_seconds_per_image": 0.0,
    "config": {
      "pool": {
        "protocol_version": "v1.0-frozen",
        "category": "metal_nut",
        "method": "diffusion",
        "split_sha256": "259a091b8681542704a69701473b03834440bc4da3371b5415e10f6b45be901c",
        "artifacts": [
          {
            "batch.npz": "bc5be45e0a5e8690e6e78aefb68a9dbc31fbb1f35fc38817fc2f2d45b6955612",
            "metadata.json": "3ba84dafc4ddcf8f6577ed7d0cbb3523fd790d4490b213eda92ae91d5323b78a",
            "provenance.json": "9467fdbdaccfb8f08d1b59e8ff190dfe599e4b078c21e9e0029a3c42d0c68e65"
          },
          {
            "batch.npz": "9a7865360d2061fbc880a71d7eb135faea8f3521527bcbb0d82bf25083998dec",
            "metadata.json": "80460599c6bf217e05fba4bbd3303f2abdafb258136d4e7dcbf62e623f8d785d",
            "provenance.json": "0cd2a2b553b662eba7aa4624aba08ef9d67807642474e92f44060dacc26fb416"
          },
          {
            "batch.npz": "65ea909d1b071a2afb2ba69d2b775f354db3f387cca3c3273f3e5279e2d15aad",
            "metadata.json": "ae1bb5562960f987224eeb9dcbbbc343519e424b50f040e3dcf59088a48ade64",
            "provenance.json": "10ef0af740bbf58800d5d63e4a84246089182b7b9312c9024d63d66f1b003b30"
          }
        ],
        "policy_hashes": {
          "src/generation/qc.py": "e0bed11f5f5d6c6eb03bcf60ccc0e15b7ffadbaf4860b53313b063465384f62e",
          "configs/experiment_scope.json": "7a5175f7ba58f29698ca47bd6b586bb8457b8e36677f4360bc87416ca9adce77",
          "configs/experiments.yaml": "b8e7eab8d9b1d51019aa2e1f41c3b842aa737c7f882487a64ff180c3d09d86b0"
        },
        "synthetic_count": 15,
        "ratio_tier_count": 5,
        "pool_sha256": "f1d6a51d966268270dfa420bf3fea201d1769814d116882737069ba95beca0f4"
      },
      "qc_reports": [
        {
          "policy_version": "synthetic-qc-v1",
          "target_met": true,
          "target_count": 5,
          "accepted_count": 5,
          "attempted_count": 5,
          "generation_seconds": 0.0,
          "qc_seconds": 0.0
        },
        {
          "policy_version": "synthetic-qc-v1",
          "target_met": true,
          "target_count": 5,
          "accepted_count": 5,
          "attempted_count": 5,
          "generation_seconds": 0.0,
          "qc_seconds": 0.0
        },
        {
          "policy_version": "synthetic-qc-v1",
          "target_met": true,
          "target_count": 5,
          "accepted_count": 5,
          "attempted_count": 5,
          "generation_seconds": 0.0,
          "qc_seconds": 0.0
        }
      ],
      "acceptance_sha256": "344ba740603417dee340c0db327290b1dc40d0124e8ffda17436c67266cd8293",
      "cost_basis": "reported generation seconds including shared-QC rejected attempts; not total wall time"
    }
  },
  "inspection": {
    "pixel_auroc": 0.7230437588470502,
    "iou": 0.047251809475647145,
    "dice": 0.09023963300537212,
    "defect_recall": 1.0,
    "image_false_positive_rate": 1.0
  },
  "training": {
    "architecture": "unet",
    "encoder": "resnet18",
    "encoder_weights": null,
    "image_size": 256,
    "steps": 1500,
    "learning_rate": 0.0001,
    "loss": 0.3513136107126872,
    "batch_size": 8,
    "sampler": "uniform_with_replacement",
    "checkpoint_selection": "final_step"
  },
  "evaluation": {
    "source": "heldout_real",
    "count": 77,
    "threshold": 0.5,
    "scope_protocol": "local-defect-scope-v1",
    "excluded_support_count": 5,
    "excluded_heldout_count": 18,
    "formal_protocol": "v1.0-frozen",
    "smoke_only": false,
    "split_sha256": "259a091b8681542704a69701473b03834440bc4da3371b5415e10f6b45be901c"
  },
  "provenance": {
    "git_commit": "b9c86812de615965a52f4af7137e407fb3997465",
    "git_dirty": false,
    "python": "3.10.21",
    "torch": "2.8.0+cu128",
    "cuda": "12.8",
    "device": "NVIDIA A40",
    "runtime_seconds": 103.01084343064576,
    "packages": {
      "segmentation-models-pytorch": "0.5.0",
      "torchvision": "0.23.0",
      "numpy": "2.2.6",
      "Pillow": "12.3.0",
      "scikit-learn": "1.7.2",
      "jsonschema": "4.26.0"
    }
  }
}
