{
  "schema_version": 1,
  "experiment_id": "real_only_metal_nut_support5_seed43",
  "category": "metal_nut",
  "method": "real_only",
  "real_train_count": 235,
  "synthetic_count": 0,
  "seed": 43,
  "generator": {
    "generation_seconds_per_image": 0.0,
    "config": {
      "fixture_only": false
    }
  },
  "inspection": {
    "pixel_auroc": 0.5247910126089302,
    "iou": 0.0013541345701636313,
    "dice": 0.0027046067388434973,
    "defect_recall": 1.0,
    "image_false_positive_rate": 1.0
  },
  "training": {
    "architecture": "unet",
    "encoder": "resnet18",
    "encoder_weights": null,
    "image_size": 256,
    "steps": 1500,
    "learning_rate": 0.0001,
    "loss": 0.27302740729848546,
    "batch_size": 8,
    "sampler": "uniform_with_replacement",
    "checkpoint_selection": "final_step"
  },
  "evaluation": {
    "source": "heldout_real",
    "count": 77,
    "threshold": 0.5,
    "scope_protocol": "local-defect-scope-v1",
    "excluded_support_count": 5,
    "excluded_heldout_count": 18,
    "formal_protocol": "v1.0-frozen",
    "smoke_only": false,
    "split_sha256": "259a091b8681542704a69701473b03834440bc4da3371b5415e10f6b45be901c"
  },
  "provenance": {
    "git_commit": "ec8fc9408e683360ebfb8fe3814891ace27e6c5d",
    "git_dirty": false,
    "python": "3.10.21",
    "torch": "2.8.0+cu128",
    "cuda": "12.8",
    "device": "NVIDIA A40",
    "runtime_seconds": 81.5357057005167,
    "packages": {
      "segmentation-models-pytorch": "0.5.0",
      "torchvision": "0.23.0",
      "numpy": "2.2.6",
      "Pillow": "12.3.0",
      "scikit-learn": "1.7.2",
      "jsonschema": "4.26.0"
    }
  }
}
